{
  "schemaVersion": "citations/v1",
  "caseId": "01-claim-evidence-review",
  "generatedAt": "2026-10-19T14:30:00Z",
  "citations": {
    "/policy_number": [
      {
        "id": "c-policy_number-1",
        "status": "proposed",
        "source": "auto",
        "method": "ocr-exact-match",
        "confidence": 0.98,
        "quote": "88929340",
        "note": "Header of the General Loss Report.",
        "createdAt": "2026-10-19T14:30:00Z",
        "anchors": [
          {
            "kind": "page-region",
            "file": "document-09.pdf",
            "page": 1,
            "boxes": [
              {
                "left": 0.5616,
                "top": 0.18434,
                "width": 0.10392,
                "height": 0.01263
              }
            ],
            "role": "label",
            "provenance": {
              "ocrFile": "document-09-ocr.json",
              "wordIndexes": [
                216,
                217
              ]
            }
          },
          {
            "kind": "page-region",
            "file": "document-09.pdf",
            "page": 1,
            "boxes": [
              {
                "left": 0.66977,
                "top": 0.18434,
                "width": 0.06536,
                "height": 0.01263
              }
            ],
            "provenance": {
              "ocrFile": "document-09-ocr.json",
              "wordIndexes": [
                218
              ]
            }
          }
        ]
      }
    ],
    "/date_of_loss": [
      {
        "id": "c-date_of_loss-1",
        "status": "proposed",
        "source": "auto",
        "method": "ocr-exact-match",
        "confidence": 0.98,
        "quote": "12/20/2025",
        "createdAt": "2026-10-19T14:30:00Z",
        "anchors": [
          {
            "kind": "page-region",
            "file": "document-09.pdf",
            "page": 1,
            "boxes": [
              {
                "left": 0.57745,
                "top": 0.21894,
                "width": 0.08808,
                "height": 0.01263
              }
            ],
            "role": "label",
            "provenance": {
              "ocrFile": "document-09-ocr.json",
              "wordIndexes": [
                227,
                228,
                229
              ]
            }
          },
          {
            "kind": "page-region",
            "file": "document-09.pdf",
            "page": 1,
            "boxes": [
              {
                "left": 0.66977,
                "top": 0.21894,
                "width": 0.07451,
                "height": 0.01263
              }
            ],
            "provenance": {
              "ocrFile": "document-09-ocr.json",
              "wordIndexes": [
                230
              ]
            }
          }
        ]
      },
      {
        "id": "c-date_of_loss-2",
        "status": "proposed",
        "source": "auto",
        "method": "text-normalized-match",
        "confidence": 0.9,
        "quote": "Dec 20, 2025",
        "note": "XactAnalysis notification email; same date in long form.",
        "createdAt": "2026-10-19T14:30:00Z",
        "anchors": [
          {
            "kind": "text-span",
            "file": "document-05.json",
            "pointer": "/bodyPlain",
            "start": 208,
            "end": 220
          }
        ]
      }
    ],
    "/type_of_loss": [
      {
        "id": "c-type_of_loss-1",
        "status": "proposed",
        "source": "auto",
        "method": "ocr-exact-match",
        "confidence": 0.98,
        "quote": "Wind - Named Storm",
        "createdAt": "2026-10-19T14:30:00Z",
        "anchors": [
          {
            "kind": "page-region",
            "file": "document-09.pdf",
            "page": 1,
            "boxes": [
              {
                "left": 0.66977,
                "top": 0.23636,
                "width": 0.14118,
                "height": 0.01263
              }
            ],
            "provenance": {
              "ocrFile": "document-09-ocr.json",
              "wordIndexes": [
                237,
                238,
                239,
                240
              ]
            }
          }
        ]
      }
    ],
    "/policy_term": [
      {
        "id": "c-policy_term-1",
        "status": "proposed",
        "source": "auto",
        "method": "ocr-fuzzy-match",
        "confidence": 0.85,
        "quote": "3/18/2025 To: 3/18/2026",
        "note": "Result value is the normalized form of this span ('To:' -> 'to').",
        "createdAt": "2026-10-19T14:30:00Z",
        "anchors": [
          {
            "kind": "page-region",
            "file": "document-09.pdf",
            "page": 1,
            "boxes": [
              {
                "left": 0.51471,
                "top": 0.34306,
                "width": 0.07075,
                "height": 0.01263
              }
            ],
            "role": "label",
            "provenance": {
              "ocrFile": "document-09-ocr.json",
              "wordIndexes": [
                103,
                104
              ]
            }
          },
          {
            "kind": "page-region",
            "file": "document-09.pdf",
            "page": 1,
            "boxes": [
              {
                "left": 0.67794,
                "top": 0.34306,
                "width": 0.18971,
                "height": 0.01263
              }
            ],
            "provenance": {
              "ocrFile": "document-09-ocr.json",
              "wordIndexes": [
                106,
                107,
                108
              ]
            }
          }
        ]
      }
    ],
    "/Tenants": [
      {
        "id": "c-Tenants-1",
        "status": "proposed",
        "source": "auto",
        "method": "ocr-exact-match",
        "confidence": 0.98,
        "quote": "Owner Occupied",
        "note": "Definition: true iff the TENANT(S): label is followed by a non-empty string.",
        "createdAt": "2026-10-19T14:30:00Z",
        "anchors": [
          {
            "kind": "page-region",
            "file": "document-09.pdf",
            "page": 1,
            "boxes": [
              {
                "left": 0.10212,
                "top": 0.62879,
                "width": 0.09232,
                "height": 0.01263
              }
            ],
            "role": "label",
            "provenance": {
              "ocrFile": "document-09-ocr.json",
              "wordIndexes": [
                249
              ]
            }
          },
          {
            "kind": "page-region",
            "file": "document-09.pdf",
            "page": 1,
            "boxes": [
              {
                "left": 0.19935,
                "top": 0.62879,
                "width": 0.11193,
                "height": 0.01326
              }
            ],
            "provenance": {
              "ocrFile": "document-09-ocr.json",
              "wordIndexes": [
                248,
                247
              ]
            }
          }
        ]
      }
    ],
    "/FA_Name": [
      {
        "id": "c-FA_Name-1",
        "status": "proposed",
        "source": "auto",
        "method": "ocr-exact-match",
        "confidence": 0.98,
        "quote": "Amyn Bana",
        "note": "Signature block, bottom of the loss report (not the insured name at the top).",
        "createdAt": "2026-10-19T14:30:00Z",
        "anchors": [
          {
            "kind": "page-region",
            "file": "document-09.pdf",
            "page": 3,
            "boxes": [
              {
                "left": 0.47059,
                "top": 0.54949,
                "width": 0.07843,
                "height": 0.01263
              }
            ],
            "provenance": {
              "ocrFile": "document-09-ocr.json",
              "wordIndexes": [
                434,
                435
              ]
            }
          }
        ]
      }
    ],
    "/Total_Claim_Value": [
      {
        "id": "c-Total_Claim_Value-1",
        "status": "accepted",
        "source": "auto",
        "method": "ocr-exact-match",
        "confidence": 0.98,
        "quote": "$812.36",
        "note": "Quote keeps the '$'; result strips it per the field definition.",
        "createdAt": "2026-10-19T14:30:00Z",
        "anchors": [
          {
            "kind": "page-region",
            "file": "document-09.pdf",
            "page": 3,
            "boxes": [
              {
                "left": 0.34363,
                "top": 0.25593,
                "width": 0.0531,
                "height": 0.01263
              }
            ],
            "provenance": {
              "ocrFile": "document-09-ocr.json",
              "wordIndexes": [
                502
              ]
            }
          }
        ]
      }
    ],
    "/garage_roof_age": []
  }
}
